[
  {
    "id": "daily_kill_wolf_001",
    "name": "Diária: Lobo (1-5)",
    "text": "Reduza a população de Lobo por perto — mate 12.",
    "monster_id": "wolf",
    "count": 12,
    "level_min": 1,
    "level_max": 5,
    "reward": {
      "xp": 6.0,
      "ryo": 21,
      "items": []
    }
  },
  {
    "id": "daily_kill_forest_deer_001b",
    "name": "Diária: Cervo — segunda leva (1-5)",
    "text": "Mais uma leva: 12 de Cervo na mesma região.",
    "monster_id": "forest_deer",
    "count": 12,
    "level_min": 1,
    "level_max": 5,
    "reward": {
      "xp": 5.4,
      "ryo": 8,
      "items": []
    }
  },
  {
    "id": "daily_hunt_wolf_001c",
    "name": "Diária: caçada rápida de Lobo (1-5)",
    "text": "Uma leva mais curta e mais bem paga: 8 de Lobo, entregue direto no quadro.",
    "monster_id": "wolf",
    "count": 8,
    "level_min": 1,
    "level_max": 5,
    "reward": {
      "xp": 5.6,
      "ryo": 22,
      "items": [
        "health_potion_small"
      ]
    }
  },
  {
    "id": "daily_kill_bandit_archer_006",
    "name": "Diária: Bandido Arqueiro (6-10)",
    "text": "Reduza a população de Bandido Arqueiro por perto — mate 12.",
    "monster_id": "bandit_archer",
    "count": 12,
    "level_min": 6,
    "level_max": 10,
    "reward": {
      "xp": 6.0,
      "ryo": 84,
      "items": []
    }
  },
  {
    "id": "daily_kill_leech_006b",
    "name": "Diária: Sanguessuga Gigante — segunda leva (6-10)",
    "text": "Mais uma leva: 12 de Sanguessuga Gigante na mesma região.",
    "monster_id": "leech",
    "count": 12,
    "level_min": 6,
    "level_max": 10,
    "reward": {
      "xp": 5.4,
      "ryo": 106,
      "items": []
    }
  },
  {
    "id": "daily_hunt_bandit_archer_006c",
    "name": "Diária: caçada rápida de Bandido Arqueiro (6-10)",
    "text": "Uma leva mais curta e mais bem paga: 8 de Bandido Arqueiro, entregue direto no quadro.",
    "monster_id": "bandit_archer",
    "count": 8,
    "level_min": 6,
    "level_max": 10,
    "reward": {
      "xp": 5.6,
      "ryo": 88,
      "items": [
        "health_potion_small"
      ]
    }
  },
  {
    "id": "daily_kill_giant_toad_011",
    "name": "Diária: Sapo Gigante (11-15)",
    "text": "Reduza a população de Sapo Gigante por perto — mate 12.",
    "monster_id": "giant_toad",
    "count": 12,
    "level_min": 11,
    "level_max": 15,
    "reward": {
      "xp": 6.0,
      "ryo": 178,
      "items": []
    }
  },
  {
    "id": "daily_kill_mercenary_bridge_011b",
    "name": "Diária: Mercenário da Ponte — segunda leva (11-15)",
    "text": "Mais uma leva: 12 de Mercenário da Ponte na mesma região.",
    "monster_id": "mercenary_bridge",
    "count": 12,
    "level_min": 11,
    "level_max": 15,
    "reward": {
      "xp": 5.4,
      "ryo": 63,
      "items": []
    }
  },
  {
    "id": "daily_hunt_giant_toad_011c",
    "name": "Diária: caçada rápida de Sapo Gigante (11-15)",
    "text": "Uma leva mais curta e mais bem paga: 8 de Sapo Gigante, entregue direto no quadro.",
    "monster_id": "giant_toad",
    "count": 8,
    "level_min": 11,
    "level_max": 15,
    "reward": {
      "xp": 5.6,
      "ryo": 187,
      "items": [
        "health_potion_small"
      ]
    }
  },
  {
    "id": "daily_kill_rogue_ninja_016",
    "name": "Diária: Ninja Renegado (16-20)",
    "text": "Reduza a população de Ninja Renegado por perto — mate 12.",
    "monster_id": "rogue_ninja",
    "count": 12,
    "level_min": 16,
    "level_max": 20,
    "reward": {
      "xp": 6.0,
      "ryo": 294,
      "items": []
    }
  },
  {
    "id": "daily_kill_lesser_serpent_016b",
    "name": "Diária: Serpente Menor — segunda leva (16-20)",
    "text": "Mais uma leva: 12 de Serpente Menor na mesma região.",
    "monster_id": "lesser_serpent",
    "count": 12,
    "level_min": 16,
    "level_max": 20,
    "reward": {
      "xp": 5.4,
      "ryo": 259,
      "items": []
    }
  },
  {
    "id": "daily_hunt_rogue_ninja_016c",
    "name": "Diária: caçada rápida de Ninja Renegado (16-20)",
    "text": "Uma leva mais curta e mais bem paga: 8 de Ninja Renegado, entregue direto no quadro.",
    "monster_id": "rogue_ninja",
    "count": 8,
    "level_min": 16,
    "level_max": 20,
    "reward": {
      "xp": 5.6,
      "ryo": 308,
      "items": [
        "health_potion_medium"
      ]
    }
  },
  {
    "id": "daily_kill_ruin_puppet_021",
    "name": "Diária: Marionete de Combate (21-25)",
    "text": "Reduza a população de Marionete de Combate por perto — mate 8.",
    "monster_id": "ruin_puppet",
    "count": 8,
    "level_min": 21,
    "level_max": 25,
    "reward": {
      "xp": 4.0,
      "ryo": 284,
      "items": []
    }
  },
  {
    "id": "daily_kill_rogue_ninja_021b",
    "name": "Diária: Ninja Renegado — segunda leva (21-25)",
    "text": "Mais uma leva: 8 de Ninja Renegado na mesma região.",
    "monster_id": "rogue_ninja",
    "count": 8,
    "level_min": 21,
    "level_max": 25,
    "reward": {
      "xp": 3.6,
      "ryo": 179,
      "items": []
    }
  },
  {
    "id": "daily_hunt_ruin_puppet_021c",
    "name": "Diária: caçada rápida de Marionete de Combate (21-25)",
    "text": "Uma leva mais curta e mais bem paga: 4 de Marionete de Combate, entregue direto no quadro.",
    "monster_id": "ruin_puppet",
    "count": 4,
    "level_min": 21,
    "level_max": 25,
    "reward": {
      "xp": 2.8,
      "ryo": 223,
      "items": [
        "health_potion_medium"
      ]
    }
  },
  {
    "id": "daily_kill_ruin_puppet_026",
    "name": "Diária: Marionete de Combate (26-30)",
    "text": "Reduza a população de Marionete de Combate por perto — mate 8.",
    "monster_id": "ruin_puppet",
    "count": 8,
    "level_min": 26,
    "level_max": 30,
    "reward": {
      "xp": 4.0,
      "ryo": 284,
      "items": []
    }
  },
  {
    "id": "daily_kill_stone_sentinel_026b",
    "name": "Diária: Sentinela de Pedra — segunda leva (26-30)",
    "text": "Mais uma leva: 8 de Sentinela de Pedra na mesma região.",
    "monster_id": "stone_sentinel",
    "count": 8,
    "level_min": 26,
    "level_max": 30,
    "reward": {
      "xp": 3.6,
      "ryo": 307,
      "items": []
    }
  },
  {
    "id": "daily_hunt_ruin_puppet_026c",
    "name": "Diária: caçada rápida de Marionete de Combate (26-30)",
    "text": "Uma leva mais curta e mais bem paga: 4 de Marionete de Combate, entregue direto no quadro.",
    "monster_id": "ruin_puppet",
    "count": 4,
    "level_min": 26,
    "level_max": 30,
    "reward": {
      "xp": 2.8,
      "ryo": 223,
      "items": [
        "health_potion_medium"
      ]
    }
  },
  {
    "id": "daily_kill_stone_sentinel_031",
    "name": "Diária: Sentinela de Pedra (31-35)",
    "text": "Reduza a população de Sentinela de Pedra por perto — mate 8.",
    "monster_id": "stone_sentinel",
    "count": 8,
    "level_min": 31,
    "level_max": 35,
    "reward": {
      "xp": 4.0,
      "ryo": 336,
      "items": []
    }
  },
  {
    "id": "daily_kill_spectral_warrior_031b",
    "name": "Diária: Guerreiro Espectral — segunda leva (31-35)",
    "text": "Mais uma leva: 8 de Guerreiro Espectral na mesma região.",
    "monster_id": "spectral_warrior",
    "count": 8,
    "level_min": 31,
    "level_max": 35,
    "reward": {
      "xp": 3.6,
      "ryo": 365,
      "items": []
    }
  },
  {
    "id": "daily_hunt_stone_sentinel_031c",
    "name": "Diária: caçada rápida de Sentinela de Pedra (31-35)",
    "text": "Uma leva mais curta e mais bem paga: 4 de Sentinela de Pedra, entregue direto no quadro.",
    "monster_id": "stone_sentinel",
    "count": 4,
    "level_min": 31,
    "level_max": 35,
    "reward": {
      "xp": 2.8,
      "ryo": 264,
      "items": [
        "chakra_pill_medium"
      ]
    }
  },
  {
    "id": "daily_kill_spectral_warrior_036",
    "name": "Diária: Guerreiro Espectral (36-40)",
    "text": "Reduza a população de Guerreiro Espectral por perto — mate 8.",
    "monster_id": "spectral_warrior",
    "count": 8,
    "level_min": 36,
    "level_max": 40,
    "reward": {
      "xp": 4.0,
      "ryo": 399,
      "items": []
    }
  },
  {
    "id": "daily_kill_stone_sentinel_036b",
    "name": "Diária: Sentinela de Pedra — segunda leva (36-40)",
    "text": "Mais uma leva: 8 de Sentinela de Pedra na mesma região.",
    "monster_id": "stone_sentinel",
    "count": 8,
    "level_min": 36,
    "level_max": 40,
    "reward": {
      "xp": 3.6,
      "ryo": 307,
      "items": []
    }
  },
  {
    "id": "daily_hunt_spectral_warrior_036c",
    "name": "Diária: caçada rápida de Guerreiro Espectral (36-40)",
    "text": "Uma leva mais curta e mais bem paga: 4 de Guerreiro Espectral, entregue direto no quadro.",
    "monster_id": "spectral_warrior",
    "count": 4,
    "level_min": 36,
    "level_max": 40,
    "reward": {
      "xp": 2.8,
      "ryo": 314,
      "items": [
        "chakra_pill_medium"
      ]
    }
  },
  {
    "id": "daily_kill_curse_shaman_041",
    "name": "Diária: Xamã da Maldição (41-45)",
    "text": "Reduza a população de Xamã da Maldição por perto — mate 8.",
    "monster_id": "curse_shaman",
    "count": 8,
    "level_min": 41,
    "level_max": 45,
    "reward": {
      "xp": 4.0,
      "ryo": 462,
      "items": []
    }
  },
  {
    "id": "daily_kill_spectral_warrior_041b",
    "name": "Diária: Guerreiro Espectral — segunda leva (41-45)",
    "text": "Mais uma leva: 8 de Guerreiro Espectral na mesma região.",
    "monster_id": "spectral_warrior",
    "count": 8,
    "level_min": 41,
    "level_max": 45,
    "reward": {
      "xp": 3.6,
      "ryo": 365,
      "items": []
    }
  },
  {
    "id": "daily_hunt_curse_shaman_041c",
    "name": "Diária: caçada rápida de Xamã da Maldição (41-45)",
    "text": "Uma leva mais curta e mais bem paga: 4 de Xamã da Maldição, entregue direto no quadro.",
    "monster_id": "curse_shaman",
    "count": 4,
    "level_min": 41,
    "level_max": 45,
    "reward": {
      "xp": 2.8,
      "ryo": 363,
      "items": [
        "chakra_pill_medium"
      ]
    }
  },
  {